identifier,date,set,download,doi,title
oai:arXiv.org:2302.09895,2023-02-21,physics:physics:geo-ph,https://arxiv.org/pdf/2302.09895,https://doi.org/10.48550/arXiv.2302.09895,Field evidence for the initiation of isolated aeolian sand patches
oai:arXiv.org:2208.00437,2023-02-22,physics:physics:geo-ph,https://arxiv.org/pdf/2208.00437,https://doi.org/10.48550/arXiv.2208.00437,Global self-similar scaling of terrestrial carbon with aridity
oai:arXiv.org:2210.03613,2023-02-22,physics:physics:geo-ph,https://arxiv.org/pdf/2210.03613,https://doi.org/10.48550/arXiv.2210.03613,3D Bayesian Variational Full Waveform Inversion
oai:arXiv.org:2205.04079,2023-02-23,physics:physics:geo-ph,https://arxiv.org/pdf/2205.04079,https://doi.org/10.48550/arXiv.2205.04079,Low coherency of wind induced seismic noise: Implications for gravitational wave detection
oai:arXiv.org:2209.15319,2023-02-23,physics:physics:geo-ph,https://arxiv.org/pdf/2209.15319,https://doi.org/10.48550/arXiv.2209.15319,Hidden jerk in universal creep and aftershocks
oai:arXiv.org:2302.10925,2023-02-23,physics:physics:geo-ph,https://arxiv.org/pdf/2302.10925,https://doi.org/10.48550/arXiv.2302.10925,Effect of Geomagnetic Storms on a Power Network at Mid Latitudes
oai:arXiv.org:2302.10986,2023-02-23,physics:physics:geo-ph,https://arxiv.org/pdf/2302.10986,https://doi.org/10.48550/arXiv.2302.10986,"The FluidFlower International Benchmark Study: Process, Modeling Results, and Comparison to Experimental Data"
oai:arXiv.org:2302.11245,2023-02-23,physics:physics:geo-ph,https://arxiv.org/pdf/2302.11245,https://doi.org/10.48550/arXiv.2302.11245,The global freshwater system: Patterns and predictability of green-blue water flux partitioning
oai:arXiv.org:2302.11348,2023-02-23,physics:physics:geo-ph,https://arxiv.org/pdf/2302.11348,https://doi.org/10.48550/arXiv.2302.11348,Quasi liquid layer-pressure asymmetrical model for the motion of of a curling rock on ice surface
oai:arXiv.org:2302.11572,2023-02-24,physics:physics:geo-ph,https://arxiv.org/pdf/2302.11572,https://doi.org/10.48550/arXiv.2302.11572,Factors Influencing Autonomously Generated 3D Geophysical Spatial Models
oai:arXiv.org:2302.12649,2023-02-27,physics:physics:geo-ph,https://arxiv.org/pdf/2302.12649,https://doi.org/10.48550/arXiv.2302.12649,Fiber-optic detection of snow avalanches using telecommunication infrastructure
oai:arXiv.org:2206.00622,2023-02-28,physics:physics:geo-ph,https://arxiv.org/pdf/2206.00622,https://doi.org/10.48550/arXiv.2206.00622,Acoustic Full Waveform Inversion with Hamiltonian Monte Carlo Method
oai:arXiv.org:2302.13907,2023-02-28,physics:physics:geo-ph,https://arxiv.org/pdf/2302.13907,https://doi.org/10.48550/arXiv.2302.13907,Parallel Modeling of the Acoustic Signal Propagation in a Cased Well
oai:arXiv.org:2212.11701,2023-03-01,physics:physics:geo-ph,https://arxiv.org/pdf/2212.11701,https://doi.org/10.48550/arXiv.2212.11701,Efficient wave type fingerprinting and filtering by six-component polarization analysis
oai:arXiv.org:2301.10518,2023-03-01,physics:physics:geo-ph,https://arxiv.org/pdf/2301.10518,https://doi.org/10.48550/arXiv.2301.10518,A Deep Gaussian Process Model for Seismicity Background Rates
oai:arXiv.org:2302.14173,2023-03-01,physics:physics:geo-ph,https://arxiv.org/pdf/2302.14173,https://doi.org/10.48550/arXiv.2302.14173,A similarity in patterns of global seismicity after St. Patrick's Day geomagnetic storms of 2013 and 2015
oai:arXiv.org:2212.07273,2023-03-02,physics:physics:geo-ph,https://arxiv.org/pdf/2212.07273,https://doi.org/10.48550/arXiv.2212.07273,Application of Machine Learning in Seismic Fragility Assessment of Bridges with SMA-Restrained Rocking Columns
oai:arXiv.org:2204.08774,2023-03-03,physics:physics:geo-ph,https://arxiv.org/pdf/2204.08774,https://doi.org/10.48550/arXiv.2204.08774,Target-oriented least-squares reverse-time migration using Marchenko double-focusing: reducing the artifacts caused by overburden multiples
oai:arXiv.org:2303.01009,2023-03-03,physics:physics:geo-ph,https://arxiv.org/pdf/2303.01009,https://doi.org/10.48550/arXiv.2303.01009,A practical implementation of data-space Hessian in the time-domain extended-source full-waveform inversion
oai:arXiv.org:2303.01785,2023-03-06,physics:physics:geo-ph,https://arxiv.org/pdf/2303.01785,https://doi.org/10.48550/arXiv.2303.01785,Time-magnitude correlations and time variation of the Gutenberg-Richter parameter in foreshock sequences
oai:arXiv.org:2303.02582,2023-03-07,physics:physics:geo-ph,https://arxiv.org/pdf/2303.02582,https://doi.org/10.48550/arXiv.2303.02582,Bifurcation of the earthquake source at the end of the Omori epoch
oai:arXiv.org:2303.02627,2023-03-07,physics:physics:geo-ph,https://arxiv.org/pdf/2303.02627,https://doi.org/10.48550/arXiv.2303.02627,MUYSC: An end-to-end muography simulation toolbox
oai:arXiv.org:2103.17010,2023-03-08,physics:physics:geo-ph,https://arxiv.org/pdf/2103.17010,https://doi.org/10.48550/arXiv.2103.17010,"Energy Release Rate, the crack closure integral and admissible singular fields in Fracture Mechanics"
oai:arXiv.org:2303.03652,2023-03-08,physics:physics:geo-ph,https://arxiv.org/pdf/2303.03652,https://doi.org/10.48550/arXiv.2303.03652,Earthquakes and related anomalous electromagnetic radiation
oai:arXiv.org:2303.04362,2023-03-09,physics:physics:geo-ph,https://arxiv.org/pdf/2303.04362,https://doi.org/10.48550/arXiv.2303.04362,"Disturbances in the Doppler frequency shift of ionospheric signal and in telluric current caused by the atmospheric waves from an explosive eruption of Hunga Tonga volcano on January 15, 2022"
oai:arXiv.org:2303.04515,2023-03-09,physics:physics:geo-ph,https://arxiv.org/pdf/2303.04515,https://doi.org/10.48550/arXiv.2303.04515,Multi-porous extension of anisotropic poroelasticity: linkage with micromechanics
oai:arXiv.org:2211.03377,2023-03-10,physics:physics:geo-ph,https://arxiv.org/pdf/2211.03377,https://doi.org/10.48550/arXiv.2211.03377,Realization of Bullard's disc dynamo
oai:arXiv.org:2303.04876,2023-03-10,physics:physics:geo-ph,https://arxiv.org/pdf/2303.04876,https://doi.org/10.48550/arXiv.2303.04876,Topological Generality and Spectral Dimensionality in the Earth Mineral Dust Source Investigation (EMIT) using Joint Characterization and the Spectral Mixture Residual
oai:arXiv.org:2303.05285,2023-03-10,physics:physics:geo-ph,https://arxiv.org/pdf/2303.05285,https://doi.org/10.48550/arXiv.2303.05285,"Pebbles, graphs and equilibria: higher order shape descriptors for sedimentary particles"
oai:arXiv.org:2303.05476,2023-03-10,physics:physics:geo-ph,https://arxiv.org/pdf/2303.05476,https://doi.org/10.48550/arXiv.2303.05476,Full-waveform tomography reveals iron spin crossover in Earth lower mantle
oai:arXiv.org:2209.11393,2023-03-14,physics:physics:geo-ph,https://arxiv.org/pdf/2209.11393,https://doi.org/10.48550/arXiv.2209.11393,Multiphase lattice Boltzmann modeling of cyclic water retention behavior in unsaturated sand based on X-ray Computed Tomography
oai:arXiv.org:2302.08747,2023-03-16,physics:physics:geo-ph,https://arxiv.org/pdf/2302.08747,https://doi.org/10.48550/arXiv.2302.08747,Seismic Arrival-time Picking on Distributed Acoustic Sensing Data using Semi-supervised Learning
oai:arXiv.org:2211.11831,2023-03-22,physics:physics:geo-ph,https://arxiv.org/pdf/2211.11831,https://doi.org/10.48550/arXiv.2211.11831,Micromechanical controls on the brittle-plastic transition in rocks
oai:arXiv.org:physics/9806031,2023-03-22,physics:physics:geo-ph,https://arxiv.org/pdf/physics/9806031,https://doi.org/10.48550/arXiv.physics/9806031,Earthquake source parameters and fault kinematics in the Eastern California Shear Zone
oai:arXiv.org:2303.11802,2023-03-23,physics:physics:geo-ph,https://arxiv.org/pdf/2303.11802,https://doi.org/10.48550/arXiv.2303.11802,Could planet/sun conjunctions be used to predict large (>=Mw7) earthquake?
oai:arXiv.org:2303.12689,2023-03-23,physics:physics:geo-ph,https://arxiv.org/pdf/2303.12689,https://doi.org/10.48550/arXiv.2303.12689,Technical barriers for deep closed-loop geothermal
oai:arXiv.org:2209.07213,2023-03-24,physics:physics:geo-ph,https://arxiv.org/pdf/2209.07213,https://doi.org/10.48550/arXiv.2209.07213,"On distributions law of planetary rotations and revolutions as a function of aphelia, following Lagrange's formulation"
oai:arXiv.org:2303.15452,2023-03-29,physics:physics:geo-ph,https://arxiv.org/pdf/2303.15452,https://doi.org/10.48550/arXiv.2303.15452,The radiation environment over the African continent at aviation altitudes: First results of the RPiRENA-based dosimeter
oai:arXiv.org:2303.16363,2023-03-30,physics:physics:geo-ph,https://arxiv.org/pdf/2303.16363,https://doi.org/10.48550/arXiv.2303.16363,Data Driven Regional Weather Forecasting: Example using the Shallow Water Equations
oai:arXiv.org:2304.00279,2023-04-04,physics:physics:geo-ph,https://arxiv.org/pdf/2304.00279,https://doi.org/10.48550/arXiv.2304.00279,"Earthquake Occurrences in the Pacific Ring of Fire Exhibit a Collective Stochastic Memory for Magnitudes, Depths, and Relative Distances of Events"
oai:arXiv.org:2304.00718,2023-04-04,physics:physics:geo-ph,https://arxiv.org/pdf/2304.00718,https://doi.org/10.48550/arXiv.2304.00718,Seismic signals generated at a water-ice interface from smoothed particle hydrodynamic simulations
oai:arXiv.org:2207.11190,2023-04-05,physics:physics:geo-ph,https://arxiv.org/pdf/2207.11190,https://doi.org/10.48550/arXiv.2207.11190,On the morphodynamics of a wide class of large-scale meandering rivers: Insights gained by coupling LES with sediment-dynamics
oai:arXiv.org:2209.03525,2023-04-05,physics:physics:geo-ph,https://arxiv.org/pdf/2209.03525,https://doi.org/10.48550/arXiv.2209.03525,Implicit Full Waveform Inversion with Deep Neural Representation
oai:arXiv.org:2211.14677,2023-04-05,physics:physics:geo-ph,https://arxiv.org/pdf/2211.14677,https://doi.org/10.48550/arXiv.2211.14677,Impacts of magnetic permeability on electromagnetic data collected in settings with steel-cased wells
oai:arXiv.org:2302.10981,2023-04-05,physics:physics:geo-ph,https://arxiv.org/pdf/2302.10981,https://doi.org/10.48550/arXiv.2302.10981,Earthquake magnitude distribution and aftershocks: a statistical geometry explanation
oai:arXiv.org:2208.02320,2023-04-06,physics:physics:geo-ph,https://arxiv.org/pdf/2208.02320,https://doi.org/10.48550/arXiv.2208.02320,Computation of effective elastic moduli of rocks using hierarchical homogenization
oai:arXiv.org:2209.11955,2023-04-06,physics:physics:geo-ph,https://arxiv.org/pdf/2209.11955,https://doi.org/10.48550/arXiv.2209.11955,Rapid Seismic Waveform Modeling and Inversion with Neural Operators
oai:arXiv.org:2304.02591,2023-04-06,physics:physics:geo-ph,https://arxiv.org/pdf/2304.02591,https://doi.org/10.48550/arXiv.2304.02591,"Tree-ring stable isotopes and radiocarbon reveal pre- and post-eruption effects of volcanic processes on trees on Mt. Etna (Sicily, Italy)"
oai:arXiv.org:2304.02597,2023-04-06,physics:physics:geo-ph,https://arxiv.org/pdf/2304.02597,https://doi.org/10.48550/arXiv.2304.02597,Lithosphere strain rate and stress field orientations near the Alpine arc in Switzerland
oai:arXiv.org:2304.02758,2023-04-07,physics:physics:geo-ph,https://arxiv.org/pdf/2304.02758,https://doi.org/10.48550/arXiv.2304.02758,Integrating U-nets into a Multi-scale Waveform Inversion for Salt Body Building
oai:arXiv.org:2304.03238,2023-04-07,physics:physics:geo-ph,https://arxiv.org/pdf/2304.03238,https://doi.org/10.48550/arXiv.2304.03238,On evanescent wave field retrieval with the Marchenko method in 2D settings
oai:arXiv.org:2304.03700,2023-04-10,physics:physics:geo-ph,https://arxiv.org/pdf/2304.03700,https://doi.org/10.48550/arXiv.2304.03700,"A Data Science Approach to Study the Water Storage Capacity in Rocky Planet Mantles: Earth, Mars, and Exoplanets"
oai:arXiv.org:2304.03817,2023-04-11,physics:physics:geo-ph,https://arxiv.org/pdf/2304.03817,https://doi.org/10.48550/arXiv.2304.03817,Comparison of different estimates of the accuracy of forecasts of the Earth's rotation parameters
oai:arXiv.org:2304.04384,2023-04-11,physics:physics:geo-ph,https://arxiv.org/pdf/2304.04384,https://doi.org/10.48550/arXiv.2304.04384,"Experiences with Distributed Acoustic Sensing using both straight and helically wound fibers in surface-deployed cables -- a case history in Groningen, The Netherlands"
oai:arXiv.org:2304.05559,2023-04-13,physics:physics:geo-ph,https://arxiv.org/pdf/2304.05559,https://doi.org/10.48550/arXiv.2304.05559,AutoHVSR: a machine-learning-supported algorithm for the fully-automated processing of horizontal-to-vertical spectral ratio measurements
oai:arXiv.org:1810.11778,2023-04-14,physics:physics:geo-ph,https://arxiv.org/pdf/1810.11778,https://doi.org/10.48550/arXiv.1810.11778,Blind Curvelet based Denoising of Seismic Surveys in Coherent and Incoherent Noise Environments
oai:arXiv.org:2304.06635,2023-04-14,physics:physics:geo-ph,https://arxiv.org/pdf/2304.06635,https://doi.org/10.48550/arXiv.2304.06635,PickBlue: Seismic phase picking for ocean bottom seismometers with deep learning
oai:arXiv.org:2304.05087,2023-04-17,physics:physics:geo-ph,https://arxiv.org/pdf/2304.05087,https://doi.org/10.48550/arXiv.2304.05087,An Efficient Deep Learning Image Condition for Locating Earthquakes
oai:arXiv.org:2304.06797,2023-04-17,physics:physics:geo-ph,https://arxiv.org/pdf/2304.06797,https://doi.org/10.48550/arXiv.2304.06797,Kinematic Earthquake Sequences on Geometrically Complex Faults
oai:arXiv.org:2206.07388,2023-04-18,physics:physics:geo-ph,https://arxiv.org/pdf/2206.07388,https://doi.org/10.48550/arXiv.2206.07388,Subsurface Depths Structure Maps Reconstruction with Generative Adversarial Networks
oai:arXiv.org:2207.05545,2023-04-18,physics:physics:geo-ph,https://arxiv.org/pdf/2207.05545,https://doi.org/10.48550/arXiv.2207.05545,"Induced earthquake source parameters, attenuation, and site effects from waveform envelopes in the Fennoscandian Shield"
oai:arXiv.org:2303.03136,2023-04-18,physics:physics:geo-ph,https://arxiv.org/pdf/2303.03136,https://doi.org/10.48550/arXiv.2303.03136,Monitoring Fluid Saturation in Reservoirs Using Time-Lapse Full-Waveform Inversion
oai:arXiv.org:2304.08016,2023-04-18,physics:physics:geo-ph,https://arxiv.org/pdf/2304.08016,https://doi.org/10.48550/arXiv.2304.08016,Does stress drop positively or negatively correlate with rupture speed?
oai:arXiv.org:2304.08316,2023-04-18,physics:physics:geo-ph,https://arxiv.org/pdf/2304.08316,https://doi.org/10.48550/arXiv.2304.08316,Subduction zone fault slip from seismic noise and GPS data
oai:arXiv.org:2304.08328,2023-04-18,physics:physics:geo-ph,https://arxiv.org/pdf/2304.08328,https://doi.org/10.48550/arXiv.2304.08328,Convolutional neural network for earthquake detection
oai:arXiv.org:2304.09780,2023-04-20,physics:physics:geo-ph,https://arxiv.org/pdf/2304.09780,https://doi.org/10.48550/arXiv.2304.09780,The role of the background velocity model for the Marchenko focusing of reflected and refracted waves
oai:arXiv.org:2304.09912,2023-04-21,physics:physics:geo-ph,https://arxiv.org/pdf/2304.09912,https://doi.org/10.48550/arXiv.2304.09912,Exploring a CNN Model for Earthquake Magnitude Estimation using HR-GNSS data
oai:arXiv.org:2304.10110,2023-04-21,physics:physics:geo-ph,https://arxiv.org/pdf/2304.10110,https://doi.org/10.48550/arXiv.2304.10110,Nonequilibrium fluctuations of global warming
oai:arXiv.org:2304.09926,2023-04-24,physics:physics:geo-ph,https://arxiv.org/pdf/2304.09926,https://doi.org/10.48550/arXiv.2304.09926,"Why POCS works, and how to make it better"
oai:arXiv.org:2304.10678,2023-04-24,physics:physics:geo-ph,https://arxiv.org/pdf/2304.10678,https://doi.org/10.48550/arXiv.2304.10678,Transdimensional surface wave tomography of the near-surface: Application to DAS data
oai:arXiv.org:2304.11273,2023-04-25,physics:physics:geo-ph,https://arxiv.org/pdf/2304.11273,https://doi.org/10.48550/arXiv.2304.11273,Enabling knowledge discovery in natural hazard engineering datasets on DesignSafe
oai:arXiv.org:2304.11399,2023-04-25,physics:physics:geo-ph,https://arxiv.org/pdf/2304.11399,https://doi.org/10.48550/arXiv.2304.11399,Ultra-fast traveltime parameters search by a coevolutionary optimization approach using graphics processing units
oai:arXiv.org:2304.12488,2023-04-26,physics:physics:geo-ph,https://arxiv.org/pdf/2304.12488,https://doi.org/10.48550/arXiv.2304.12488,Estimating ensemble likelihoods for the Sentinel-1 based Global Flood Monitoring product of the Copernicus Emergency Management Service
oai:arXiv.org:2301.01939,2023-04-27,physics:physics:geo-ph,https://arxiv.org/pdf/2301.01939,https://doi.org/10.48550/arXiv.2301.01939,Thomsen-type parameters and attenuation coefficients for constant-Q transverse isotropy
oai:arXiv.org:2304.13197,2023-04-27,physics:physics:geo-ph,https://arxiv.org/pdf/2304.13197,https://doi.org/10.48550/arXiv.2304.13197,A phase-field model for hydraulic fracture nucleation and propagation in porous media
oai:arXiv.org:2304.13619,2023-04-27,physics:physics:geo-ph,https://arxiv.org/pdf/2304.13619,https://doi.org/10.48550/arXiv.2304.13619,Recompositing of Vast Irregularly-Sampled Seismic Data via Compressed Sensing Framework: An FPOCS Based on Seislet Transform Approach
oai:arXiv.org:2304.14307,2023-04-28,physics:physics:geo-ph,https://arxiv.org/pdf/2304.14307,https://doi.org/10.48550/arXiv.2304.14307,A Method for Classifying Snow Using Ski-Mounted Strain Sensors
oai:arXiv.org:2305.00874,2023-05-02,physics:physics:geo-ph,https://arxiv.org/pdf/2305.00874,https://doi.org/10.48550/arXiv.2305.00874,The Optimization and Application of The Propagated Riemannian Wavefield Extrapolator in VTI Media- Pseudo-Depth Domain Least-Squares Reverse-Time Migration
oai:arXiv.org:2211.01117,2023-05-03,physics:physics:geo-ph,https://arxiv.org/pdf/2211.01117,https://doi.org/10.48550/arXiv.2211.01117,Physics-driven Deep Learning Inversion for Direct Current Resistivity Survey Data
oai:arXiv.org:2304.00233,2023-05-03,physics:physics:geo-ph,https://arxiv.org/pdf/2304.00233,https://doi.org/10.48550/arXiv.2304.00233,libEMM: A fictious wave domain 3D CSEM modelling library bridging sequential and parallel GPU implementation
oai:arXiv.org:2305.01468,2023-05-03,physics:physics:geo-ph,https://arxiv.org/pdf/2305.01468,https://doi.org/10.48550/arXiv.2305.01468,Long-range fiber-optic earthquake sensing by active phase noise cancellation
oai:arXiv.org:2305.01701,2023-05-04,physics:physics:geo-ph,https://arxiv.org/pdf/2305.01701,https://doi.org/10.48550/arXiv.2305.01701,Resolving Strain Localization of Brittle and Ductile Deformation in two- and three-dimensions using Graphical Processing Units (GPUs)
oai:arXiv.org:2305.01718,2023-05-04,physics:physics:geo-ph,https://arxiv.org/pdf/2305.01718,https://doi.org/10.48550/arXiv.2305.01718,A tale of two faults: Statistical reconstruction of the 1820 Flores Sea earthquake using tsunami observations alone
oai:arXiv.org:2204.12310,2023-05-05,physics:physics:geo-ph,https://arxiv.org/pdf/2204.12310,https://doi.org/10.48550/arXiv.2204.12310,Observation of large scale precursor correlations between cosmic rays and earthquakes
oai:arXiv.org:2305.02775,2023-05-05,physics:physics:geo-ph,https://arxiv.org/pdf/2305.02775,https://doi.org/10.48550/arXiv.2305.02775,Earthquake activity as captured using the network approach
oai:arXiv.org:2305.04583,2023-05-09,physics:physics:geo-ph,https://arxiv.org/pdf/2305.04583,https://doi.org/10.48550/arXiv.2305.04583,"Shallow shear-wave (SV) reflection surveying with distributed acoustic sensing in Zuidbroek, the Netherlands"
oai:arXiv.org:2305.05150,2023-05-10,physics:physics:geo-ph,https://arxiv.org/pdf/2305.05150,https://doi.org/10.48550/arXiv.2305.05150,Physics-informed neural network for seismic wave inversion in layered semi-infinite domain
oai:arXiv.org:2305.06490,2023-05-12,physics:physics:geo-ph,https://arxiv.org/pdf/2305.06490,https://doi.org/10.48550/arXiv.2305.06490,Estimating sea ice properties from wave observations in sea ice
oai:arXiv.org:2305.06519,2023-05-12,physics:physics:geo-ph,https://arxiv.org/pdf/2305.06519,https://doi.org/10.48550/arXiv.2305.06519,Homogenizing elastic properties of large digital rock images by combining CNN with hierarchical homogenization method
oai:arXiv.org:2305.06735,2023-05-12,physics:physics:geo-ph,https://arxiv.org/pdf/2305.06735,https://doi.org/10.48550/arXiv.2305.06735,Unsupervised noise reductions for gravitational reference sensors or accelerometers based on Noise2Noise method
oai:arXiv.org:2305.07145,2023-05-15,physics:physics:geo-ph,https://arxiv.org/pdf/2305.07145,https://doi.org/10.48550/arXiv.2305.07145,Enhancing Petrophysical Studies with Machine Learning: A Field Case Study on Permeability Prediction in Heterogeneous Reservoirs
oai:arXiv.org:1805.03695,2023-05-16,physics:physics:geo-ph,https://arxiv.org/pdf/1805.03695,https://doi.org/10.48550/arXiv.1805.03695,Comparison of Algorithms for Baseline Correction of LIBS Spectra for Quantifying Total Carbon in Brazilian Soils
oai:arXiv.org:2305.07921,2023-05-16,physics:physics:geo-ph,https://arxiv.org/pdf/2305.07921,https://doi.org/10.48550/arXiv.2305.07921,Physics reliable frugal uncertainty analysis for full waveform inversion
oai:arXiv.org:2305.09136,2023-05-17,physics:physics:geo-ph,https://arxiv.org/pdf/2305.09136,https://doi.org/10.48550/arXiv.2305.09136,Seismic Coherent Noise Removal with Residual Network and Synthetic Seismic Simples
oai:arXiv.org:2305.09762,2023-05-18,physics:physics:geo-ph,https://arxiv.org/pdf/2305.09762,https://doi.org/10.48550/arXiv.2305.09762,An integrated experimental and computational framework for modeling creep behavior in shale rocks induced by chemo-mechanical loading
oai:arXiv.org:2303.04510,2023-05-19,physics:physics:geo-ph,https://arxiv.org/pdf/2303.04510,https://doi.org/10.48550/arXiv.2303.04510,Multi-porous extension of anisotropic poroelasticity: consolidation and related coefficients
oai:arXiv.org:2305.11183,2023-05-22,physics:physics:geo-ph,https://arxiv.org/pdf/2305.11183,https://doi.org/10.48550/arXiv.2305.11183,Assessing the predicting power of GPS data for aftershocks forecasting
oai:arXiv.org:2301.12701,2023-05-23,physics:physics:geo-ph,https://arxiv.org/pdf/2301.12701,https://doi.org/10.48550/arXiv.2301.12701,High-pressure order-disorder transition in Mg$_2$SiO$_4$: Implications for super-Earth mineralogy
oai:arXiv.org:2305.13138,2023-05-23,physics:physics:geo-ph,https://arxiv.org/pdf/2305.13138,https://doi.org/10.48550/arXiv.2305.13138,Enhancing Understanding of Hydraulic Fracture Tip Advancement through Inversion of Low-Frequency Distributed Acoustic Sensing Data
oai:arXiv.org:2305.13176,2023-05-23,physics:physics:geo-ph,https://arxiv.org/pdf/2305.13176,https://doi.org/10.48550/arXiv.2305.13176,On the layer crossing problem for a semi-infinite hydraulic fracture
oai:arXiv.org:2305.13321,2023-05-24,physics:physics:geo-ph,https://arxiv.org/pdf/2305.13321,https://doi.org/10.48550/arXiv.2305.13321,A brief overview of Turkiye Earthquake: insight into the building damage
oai:arXiv.org:2305.13345,2023-05-24,physics:physics:geo-ph,https://arxiv.org/pdf/2305.13345,https://doi.org/10.48550/arXiv.2305.13345,Isotopic constraints on lightning as a source of fixed nitrogen in Earth's early biosphere
oai:arXiv.org:2305.13407,2023-05-24,physics:physics:geo-ph,https://arxiv.org/pdf/2305.13407,https://doi.org/10.48550/arXiv.2305.13407,Application of virtual seismology to DAS data in Groningen
oai:arXiv.org:2305.13714,2023-05-24,physics:physics:geo-ph,https://arxiv.org/pdf/2305.13714,https://doi.org/10.48550/arXiv.2305.13714,An implicit level set algorithm for hydraulic fracturing with a stress-layer asymptote
oai:arXiv.org:2305.13990,2023-05-24,physics:physics:geo-ph,https://arxiv.org/pdf/2305.13990,https://doi.org/10.48550/arXiv.2305.13990,Deep Learning-based extraction of surface wave dispersion curves from seismic shot gathers
oai:arXiv.org:2305.15578,2023-05-26,physics:physics:geo-ph,https://arxiv.org/pdf/2305.15578,https://doi.org/10.48550/arXiv.2305.15578,An Open-Access Database of Active-source and Passive-wavefield DAS and Nodal Station Measurements at the Newberry Florida Site
oai:arXiv.org:2305.17642,2023-05-30,physics:physics:geo-ph,https://arxiv.org/pdf/2305.17642,https://doi.org/10.48550/arXiv.2305.17642,Geomechanics in unconventional resource development
oai:arXiv.org:2303.15659,2023-05-31,physics:physics:geo-ph,https://arxiv.org/pdf/2303.15659,https://doi.org/10.48550/arXiv.2303.15659,Boundary-to-Solution Mapping for Groundwater Flows in a Toth Basin
oai:arXiv.org:2305.18883,2023-05-31,physics:physics:geo-ph,https://arxiv.org/pdf/2305.18883,https://doi.org/10.48550/arXiv.2305.18883,"About the aftershocks, the Omori law, and the Utsu formula"
oai:arXiv.org:2305.19536,2023-06-01,physics:physics:geo-ph,https://arxiv.org/pdf/2305.19536,https://doi.org/10.48550/arXiv.2305.19536,Nonlinearities of Penman and Penman-Monteith Equations across Multiple Timescales
oai:arXiv.org:2111.11033,2023-06-02,physics:physics:geo-ph,https://arxiv.org/pdf/2111.11033,https://doi.org/10.48550/arXiv.2111.11033,Oxygen-driven enhancement of electron correlation in hexagonal iron at Earth's inner core conditions
oai:arXiv.org:2305.13249,2023-06-02,physics:physics:geo-ph,https://arxiv.org/pdf/2305.13249,https://doi.org/10.48550/arXiv.2305.13249,Tsunami and megathrust earthquake disaster prevention warnings: Real-time monitoring of the genesis processes with Physical Wavelets
oai:arXiv.org:2306.00773,2023-06-02,physics:physics:geo-ph,https://arxiv.org/pdf/2306.00773,https://doi.org/10.48550/arXiv.2306.00773,Characterizing the impacts of multi-scale heterogeneity on solute transport in fracture networks
oai:arXiv.org:2208.09486,2023-06-05,physics:physics:geo-ph,https://arxiv.org/pdf/2208.09486,https://doi.org/10.48550/arXiv.2208.09486,Significant and megathrust earthquake predictions by real-time monitoring of the genesis processes with Physical Wavelets
