identifier,date,set,download,doi,title
oai:arXiv.org:1110.6635,2020-02-20,physics:physics:geo-ph,https://arxiv.org/pdf/1110.6635,https://doi.org/10.48550/arXiv.1110.6635,Dispersive waves generated by an underwater landslide
oai:arXiv.org:1803.00787,2020-02-20,physics:physics:geo-ph,https://arxiv.org/pdf/1803.00787,https://doi.org/10.48550/arXiv.1803.00787,Evaluation of tsunami wave energy generated by earthquakes in the Makran subduction zone
oai:arXiv.org:1803.11481,2020-02-20,physics:physics:geo-ph,https://arxiv.org/pdf/1803.11481,https://doi.org/10.48550/arXiv.1803.11481,Tsunami hazard assessment in the Makran subduction zone
oai:arXiv.org:2002.08169,2020-02-20,physics:physics:geo-ph,https://arxiv.org/pdf/2002.08169,https://doi.org/10.48550/arXiv.2002.08169,Kinematic wave solutions for dam-break floods in non-uniform valleys
oai:arXiv.org:2002.08607,2020-02-21,physics:physics:geo-ph,https://arxiv.org/pdf/2002.08607,https://doi.org/10.48550/arXiv.2002.08607,The near surface vertical atmospheric electric field abnormality could be as a promising imminent precursor of major earthquakes
oai:arXiv.org:2002.08954,2020-02-24,physics:physics:geo-ph,https://arxiv.org/pdf/2002.08954,https://doi.org/10.48550/arXiv.2002.08954,Spring-Slider and Finite Element Modeling of Microseismic Events and Fault Slip during Hydraulic Fracturing
oai:arXiv.org:1903.12298,2020-02-25,physics:physics:geo-ph,https://arxiv.org/pdf/1903.12298,https://doi.org/10.48550/arXiv.1903.12298,Rupture process of 2013 Shonbe earthquake sequence
oai:arXiv.org:2002.11515,2020-02-27,physics:physics:geo-ph,https://arxiv.org/pdf/2002.11515,https://doi.org/10.48550/arXiv.2002.11515,"Magmatic volatiles to assess permeable volcano-tectonic structures in the Los Humeros geothermal field, Mexico"
oai:arXiv.org:1808.09603,2020-03-03,physics:physics:geo-ph,https://arxiv.org/pdf/1808.09603,https://doi.org/10.48550/arXiv.1808.09603,Locating earthquakes with a network of seismic stations via a deep learning method
oai:arXiv.org:2001.06416,2020-03-03,physics:physics:geo-ph,https://arxiv.org/pdf/2001.06416,https://doi.org/10.48550/arXiv.2001.06416,SeismiQB -- a novel framework for deep learning with seismic data
oai:arXiv.org:2003.00461,2020-03-03,physics:physics:geo-ph,https://arxiv.org/pdf/2003.00461,https://doi.org/10.48550/arXiv.2003.00461,Parametric study of the seismic response of a hill or mountain
oai:arXiv.org:2003.01159,2020-03-04,physics:physics:geo-ph,https://arxiv.org/pdf/2003.01159,https://doi.org/10.48550/arXiv.2003.01159,Time-domain sparsity promoting least-squares reverse time migration with source estimation
oai:arXiv.org:2002.07614,2020-03-06,physics:physics:geo-ph,https://arxiv.org/pdf/2002.07614,https://doi.org/10.48550/arXiv.2002.07614,"The physics of sediment transport initiation, cessation, and entrainment across aeolian and fluvial environments"
oai:arXiv.org:2002.01636,2020-03-09,physics:physics:geo-ph,https://arxiv.org/pdf/2002.01636,https://doi.org/10.48550/arXiv.2002.01636,Magnetic Induction in Convecting Galilean Oceans
oai:arXiv.org:1911.02927,2020-03-12,physics:physics:geo-ph,https://arxiv.org/pdf/1911.02927,https://doi.org/10.48550/arXiv.1911.02927,"Gravity, topography, and melt generation rates from simple 3D models of mantle convection"
oai:arXiv.org:2003.05705,2020-03-13,physics:physics:geo-ph,https://arxiv.org/pdf/2003.05705,https://doi.org/10.48550/arXiv.2003.05705,Genesis of primitive Hawaiian rejuvenated-stage lavas: Evidence for carbonatite metasomatism and implications for ancient eclogite source
oai:arXiv.org:1911.04136,2020-03-18,physics:physics:geo-ph,https://arxiv.org/pdf/1911.04136,https://doi.org/10.48550/arXiv.1911.04136,Blocked radiative heat transport in the hot pyrolitic lower mantle
oai:arXiv.org:2003.07474,2020-03-18,physics:physics:geo-ph,https://arxiv.org/pdf/2003.07474,https://doi.org/10.48550/arXiv.2003.07474,Fully reversible neural networks for large-scale surface and sub-surface characterization via remote sensing
oai:arXiv.org:2003.07593,2020-03-18,physics:physics:geo-ph,https://arxiv.org/pdf/2003.07593,https://doi.org/10.48550/arXiv.2003.07593,Global Earthquake Prediction Systems
oai:arXiv.org:2002.03163,2020-03-19,physics:physics:geo-ph,https://arxiv.org/pdf/2002.03163,https://doi.org/10.48550/arXiv.2002.03163,ML-misfit: Learning a robust misfit function for full-waveform inversion using machine learning
oai:arXiv.org:2003.08098,2020-03-19,physics:physics:geo-ph,https://arxiv.org/pdf/2003.08098,https://doi.org/10.48550/arXiv.2003.08098,Advancing quantitative understanding of self-potential signatures in the critical zone through long-term monitoring
oai:arXiv.org:2003.08241,2020-03-19,physics:physics:geo-ph,https://arxiv.org/pdf/2003.08241,https://doi.org/10.48550/arXiv.2003.08241,"Modeling Streaming Potential in Porous and Fractured Media, Description and Benefits of the Effective Excess Charge Density Approach"
oai:arXiv.org:2003.08466,2020-03-20,physics:physics:geo-ph,https://arxiv.org/pdf/2003.08466,https://doi.org/10.48550/arXiv.2003.08466,Fully reversible neural networks for large-scale 3D seismic horizon tracking
oai:arXiv.org:2003.09376,2020-03-23,physics:physics:geo-ph,https://arxiv.org/pdf/2003.09376,https://doi.org/10.48550/arXiv.2003.09376,Actinides measurements on environmental samples of the Garigliano Nuclear Power Plant (Italy) during the decommissioning phase
oai:arXiv.org:2003.09385,2020-03-23,physics:physics:geo-ph,https://arxiv.org/pdf/2003.09385,https://doi.org/10.48550/arXiv.2003.09385,Numerical Evaluation of Fragility Curves for Earthquake-Liquefaction-Induced Settlements of an Embankment
oai:arXiv.org:2003.09387,2020-03-23,physics:physics:geo-ph,https://arxiv.org/pdf/2003.09387,https://doi.org/10.48550/arXiv.2003.09387,"Rapid 14C excursion at 3372-3371 BCE not observed at two different locations, a comment on Wang et al. (2017)"
oai:arXiv.org:2003.09388,2020-03-23,physics:physics:geo-ph,https://arxiv.org/pdf/2003.09388,https://doi.org/10.48550/arXiv.2003.09388,Image Gravimetry: A New Remote Sensing Approach for Gravity Analysis in Geophysics
oai:arXiv.org:2003.09406,2020-03-23,physics:physics:geo-ph,https://arxiv.org/pdf/2003.09406,https://doi.org/10.48550/arXiv.2003.09406,"Eigenrays in 3D heterogeneous anisotropic media: Part I -- Kinematics, Variational formulation"
oai:arXiv.org:2003.09407,2020-03-23,physics:physics:geo-ph,https://arxiv.org/pdf/2003.09407,https://doi.org/10.48550/arXiv.2003.09407,"Eigenrays in 3D heterogeneous anisotropic media: Part II -- Kinematics, Validation of the Lagrangian"
oai:arXiv.org:2003.09408,2020-03-23,physics:physics:geo-ph,https://arxiv.org/pdf/2003.09408,https://doi.org/10.48550/arXiv.2003.09408,"Eigenrays in 3D heterogeneous anisotropic media: Part III -- Kinematics, Finite-element implementation"
oai:arXiv.org:2001.10059,2020-03-24,physics:physics:geo-ph,https://arxiv.org/pdf/2001.10059,https://doi.org/10.48550/arXiv.2001.10059,Modeling water relative permeability in uniform grain packs
oai:arXiv.org:2001.10835,2020-03-24,physics:physics:geo-ph,https://arxiv.org/pdf/2001.10835,https://doi.org/10.48550/arXiv.2001.10835,Modeling single-phase permeability in uniform grain packs
oai:arXiv.org:2003.10242,2020-03-24,physics:physics:geo-ph,https://arxiv.org/pdf/2003.10242,https://doi.org/10.48550/arXiv.2003.10242,Eigenrays in 3D heterogeneous anisotropic media: Part IV -- Geometric spreading from traveltime Hessian
oai:arXiv.org:2003.10243,2020-03-24,physics:physics:geo-ph,https://arxiv.org/pdf/2003.10243,https://doi.org/10.48550/arXiv.2003.10243,"Eigenrays in 3D heterogeneous anisotropic media: Part V -- Dynamics, Variational formulation"
oai:arXiv.org:2003.10244,2020-03-24,physics:physics:geo-ph,https://arxiv.org/pdf/2003.10244,https://doi.org/10.48550/arXiv.2003.10244,"Eigenrays in 3D heterogeneous anisotropic media: Part VI -- Dynamics, Lagrangian vs. Hamiltonian approaches"
oai:arXiv.org:2003.10736,2020-03-25,physics:physics:geo-ph,https://arxiv.org/pdf/2003.10736,https://doi.org/10.48550/arXiv.2003.10736,Widening of the Andes: an interplay between subduction dynamics and crustal wedge tectonics
oai:arXiv.org:2003.10738,2020-03-25,physics:physics:geo-ph,https://arxiv.org/pdf/2003.10738,https://doi.org/10.48550/arXiv.2003.10738,"Employing internal multiples in time-lapse seismic monitoring, using the Marchenko method"
oai:arXiv.org:2003.10749,2020-03-25,physics:physics:geo-ph,https://arxiv.org/pdf/2003.10749,https://doi.org/10.48550/arXiv.2003.10749,An overview of Marchenko methods
oai:arXiv.org:2003.10772,2020-03-25,physics:physics:geo-ph,https://arxiv.org/pdf/2003.10772,https://doi.org/10.48550/arXiv.2003.10772,Data-driven internal multiple elimination applications using imperfectly sampled reflection data
oai:arXiv.org:2003.10802,2020-03-25,physics:physics:geo-ph,https://arxiv.org/pdf/2003.10802,https://doi.org/10.48550/arXiv.2003.10802,Correcting for imperfectly sampled data in the iterative Marchenko scheme
oai:arXiv.org:2003.11057,2020-03-26,physics:physics:geo-ph,https://arxiv.org/pdf/2003.11057,https://doi.org/10.48550/arXiv.2003.11057,A new role for adaptive filters in Marchenko equation-based methods for the attenuation of internal multiples
oai:arXiv.org:2003.11418,2020-03-26,physics:physics:geo-ph,https://arxiv.org/pdf/2003.11418,https://doi.org/10.48550/arXiv.2003.11418,"Eigenrays in 3D heterogeneous anisotropic media: Part VII -- Dynamics, Finite-element implementation"
oai:arXiv.org:2003.11826,2020-03-27,physics:physics:geo-ph,https://arxiv.org/pdf/2003.11826,https://doi.org/10.48550/arXiv.2003.11826,A Geothermal Well Doublet for Research and Heat Supply of the TU Delft Campus
oai:arXiv.org:2003.12539,2020-03-30,physics:physics:geo-ph,https://arxiv.org/pdf/2003.12539,https://doi.org/10.48550/arXiv.2003.12539,Improved Earthquake Forecasting Model Based on Long-term Memory in Earthquake
oai:arXiv.org:1911.11608,2020-03-31,physics:physics:geo-ph,https://arxiv.org/pdf/1911.11608,https://doi.org/10.48550/arXiv.1911.11608,Periodicity in fields of elongating dunes
oai:arXiv.org:2003.08541,2020-03-31,physics:physics:geo-ph,https://arxiv.org/pdf/2003.08541,https://doi.org/10.48550/arXiv.2003.08541,Meteorology and Oceanography on a Flat Earth
oai:arXiv.org:2003.12888,2020-03-31,physics:physics:geo-ph,https://arxiv.org/pdf/2003.12888,https://doi.org/10.48550/arXiv.2003.12888,Kinematic aspects of residual prestack migration
oai:arXiv.org:1904.10906,2020-04-01,physics:physics:geo-ph,https://arxiv.org/pdf/1904.10906,https://doi.org/10.48550/arXiv.1904.10906,Dilatancy-induced fluid pressure drop during dynamic rupture: Direct experimental evidence and consequences for earthquake dynamics
oai:arXiv.org:1912.00617,2020-04-01,physics:physics:geo-ph,https://arxiv.org/pdf/1912.00617,https://doi.org/10.48550/arXiv.1912.00617,Locally resonant metasurfaces for shear waves in granular media
oai:arXiv.org:1912.12258,2020-04-02,physics:physics:geo-ph,https://arxiv.org/pdf/1912.12258,https://doi.org/10.48550/arXiv.1912.12258,The fate of liquids trapped during the Earth's inner core growth
oai:arXiv.org:2003.12538,2020-04-03,physics:physics:geo-ph,https://arxiv.org/pdf/2003.12538,https://doi.org/10.48550/arXiv.2003.12538,Full Waveform Inversion by Source Extension: Why it works
oai:arXiv.org:2004.01747,2020-04-07,physics:physics:geo-ph,https://arxiv.org/pdf/2004.01747,https://doi.org/10.48550/arXiv.2004.01747,"3D Marchenko internal multiple attenuation on narrow azimuth streamer data of the Santos Basin, Brazil"
oai:arXiv.org:2004.02300,2020-04-07,physics:physics:geo-ph,https://arxiv.org/pdf/2004.02300,https://doi.org/10.48550/arXiv.2004.02300,On the correlation between solar activity and large earthquakes worldwide
oai:arXiv.org:2004.02734,2020-04-07,physics:physics:geo-ph,https://arxiv.org/pdf/2004.02734,https://doi.org/10.48550/arXiv.2004.02734,Exploring Basement Surface relationship of north-west Bengal Basin using satellite images and tectonic modeling
oai:arXiv.org:2003.08988,2020-04-08,physics:physics:geo-ph,https://arxiv.org/pdf/2003.08988,https://doi.org/10.48550/arXiv.2003.08988,Gas relative permeability in unconventional reservoir rocks
oai:arXiv.org:1911.02784,2020-04-13,physics:physics:geo-ph,https://arxiv.org/pdf/1911.02784,https://doi.org/10.48550/arXiv.1911.02784,Comparison of AATR and WTEC indices in the studies of the level of ionospheric disturbance
oai:arXiv.org:1405.0307,2020-04-14,physics:physics:geo-ph,https://arxiv.org/pdf/1405.0307,https://doi.org/10.48550/arXiv.1405.0307,Towards Evidence of Long-Range Correlations in Shallow Seismic Activities
oai:arXiv.org:2004.05674,2020-04-14,physics:physics:geo-ph,https://arxiv.org/pdf/2004.05674,https://doi.org/10.48550/arXiv.2004.05674,Long-range correlation studies in deep earthquakes global series
oai:arXiv.org:2004.00227,2020-04-16,physics:physics:geo-ph,https://arxiv.org/pdf/2004.00227,https://doi.org/10.48550/arXiv.2004.00227,Uncertainty quantification in imaging and automatic horizon tracking: a Bayesian deep-prior based approach
oai:arXiv.org:2004.07037,2020-04-16,physics:physics:geo-ph,https://arxiv.org/pdf/2004.07037,https://doi.org/10.48550/arXiv.2004.07037,On the possibility of seismic rogue waves in very soft soils
oai:arXiv.org:1909.01197,2020-04-17,physics:physics:geo-ph,https://arxiv.org/pdf/1909.01197,https://doi.org/10.48550/arXiv.1909.01197,Self-similarity of low-frequency earthquakes
oai:arXiv.org:2004.07355,2020-04-17,physics:physics:geo-ph,https://arxiv.org/pdf/2004.07355,https://doi.org/10.48550/arXiv.2004.07355,Time-domain Wavefield Reconstruction Inversion in a TTI medium
oai:arXiv.org:2004.07388,2020-04-17,physics:physics:geo-ph,https://arxiv.org/pdf/2004.07388,https://doi.org/10.48550/arXiv.2004.07388,Transfer learning in large-scale ocean bottom seismic wavefield reconstruction
oai:arXiv.org:2004.07871,2020-04-20,physics:physics:geo-ph,https://arxiv.org/pdf/2004.07871,https://doi.org/10.48550/arXiv.2004.07871,"Parameterizing uncertainty by deep invertible networks, an application to reservoir characterization"
oai:arXiv.org:1910.08766,2020-04-21,physics:physics:geo-ph,https://arxiv.org/pdf/1910.08766,https://doi.org/10.48550/arXiv.1910.08766,Noise level forecasts at 8-20MHz and their use for morphological studies of ionospheric absorption variations at EKB ISTP SB RAS radar
oai:arXiv.org:1911.04093,2020-04-21,physics:physics:geo-ph,https://arxiv.org/pdf/1911.04093,https://doi.org/10.48550/arXiv.1911.04093,Paradox of Modeling Curved Faults Revisited with General Non-Hypersingular Stress Green's Functions
oai:arXiv.org:2003.08959,2020-04-21,physics:physics:geo-ph,https://arxiv.org/pdf/2003.08959,https://doi.org/10.48550/arXiv.2003.08959,On-deck seismology: Lessons from InSight for future planetary seismology
oai:arXiv.org:1901.10066,2020-04-22,physics:physics:geo-ph,https://arxiv.org/pdf/1901.10066,https://doi.org/10.48550/arXiv.1901.10066,Formulation of a Triaxial Three-Layered Earth Rotation: I. Theory and Rotational Normal Mode Solutions
oai:arXiv.org:1906.08033,2020-04-22,physics:physics:geo-ph,https://arxiv.org/pdf/1906.08033,https://doi.org/10.48550/arXiv.1906.08033,Probing slow earthquakes with deep learning
oai:arXiv.org:1906.10604,2020-04-22,physics:physics:geo-ph,https://arxiv.org/pdf/1906.10604,https://doi.org/10.48550/arXiv.1906.10604,Introducing a response-based duration metric and its correlation with structural damages
oai:arXiv.org:1907.00496,2020-04-22,physics:physics:geo-ph,https://arxiv.org/pdf/1907.00496,https://doi.org/10.48550/arXiv.1907.00496,Directivity Modes of Earthquake Populations with Unsupervised Learning
oai:arXiv.org:1907.12184,2020-04-22,physics:physics:geo-ph,https://arxiv.org/pdf/1907.12184,https://doi.org/10.48550/arXiv.1907.12184,Reference Models for Lithospheric Geoneutrino Signal
oai:arXiv.org:1909.12395,2020-04-22,physics:physics:geo-ph,https://arxiv.org/pdf/1909.12395,https://doi.org/10.48550/arXiv.1909.12395,Machine Learning Reveals the Seismic Signature of Eruptive Behavior at Piton de la Fournaise Volcano
oai:arXiv.org:2004.01597,2020-04-22,physics:physics:geo-ph,https://arxiv.org/pdf/2004.01597,https://doi.org/10.48550/arXiv.2004.01597,Pressure torque of torsional Alfvn modes acting on an ellipsoidal mantle
oai:arXiv.org:1907.03234,2020-04-28,physics:physics:geo-ph,https://arxiv.org/pdf/1907.03234,https://doi.org/10.48550/arXiv.1907.03234,An investigation on the effect of the near-fault earthquakes on the seismic behavior of RC Moment Resisting Frames (MRFs) designed based on Iranian seismic code (standard no. 2800)
oai:arXiv.org:2004.12244,2020-04-28,physics:physics:geo-ph,https://arxiv.org/pdf/2004.12244,https://doi.org/10.48550/arXiv.2004.12244,Dynamo action in sliding plates of anisotropic electrical conductivity
oai:arXiv.org:2004.13124,2020-04-29,physics:physics:geo-ph,https://arxiv.org/pdf/2004.13124,https://doi.org/10.48550/arXiv.2004.13124,"GipsyX/RTGx, A New Tool Set for Space Geodetic Operations and Research"
oai:arXiv.org:2005.00131,2020-05-04,physics:physics:geo-ph,https://arxiv.org/pdf/2005.00131,https://doi.org/10.48550/arXiv.2005.00131,COVID-19 societal response captured by seismic noise in China and Italy
oai:arXiv.org:1908.03554,2020-05-05,physics:physics:geo-ph,https://arxiv.org/pdf/1908.03554,https://doi.org/10.48550/arXiv.1908.03554,Topological properties of epidemic aftershock processes
oai:arXiv.org:2005.00590,2020-05-05,physics:physics:geo-ph,https://arxiv.org/pdf/2005.00590,https://doi.org/10.48550/arXiv.2005.00590,Multiple scattering theory for strong scattering heterogeneous elastic continua with triaxial inhomogeneities: theoretical fundamentals and applications
oai:arXiv.org:1912.07552,2020-05-06,physics:physics:geo-ph,https://arxiv.org/pdf/1912.07552,https://doi.org/10.48550/arXiv.1912.07552,Coupled Time-lapse Full Waveform Inversion for Subsurface Flow Problems using Intrusive Automatic Differentiation
oai:arXiv.org:2005.01846,2020-05-06,physics:physics:geo-ph,https://arxiv.org/pdf/2005.01846,https://doi.org/10.48550/arXiv.2005.01846,Accurate 2.5D frequency domain radar waves modelling using weighted-averaging difference operators
oai:arXiv.org:2005.01871,2020-05-06,physics:physics:geo-ph,https://arxiv.org/pdf/2005.01871,https://doi.org/10.48550/arXiv.2005.01871,Structural response of alpha-quartz under plate-impact shock compression
oai:arXiv.org:1812.03612,2020-05-07,physics:physics:geo-ph,https://arxiv.org/pdf/1812.03612,https://doi.org/10.48550/arXiv.1812.03612,Circadian rhythm of dune-field activity
oai:arXiv.org:2004.06797,2020-05-07,physics:physics:geo-ph,https://arxiv.org/pdf/2004.06797,https://doi.org/10.48550/arXiv.2004.06797,Site characterization at downhole arrays by joint inversion of dispersion data and acceleration time series
oai:arXiv.org:2005.02776,2020-05-07,physics:physics:geo-ph,https://arxiv.org/pdf/2005.02776,https://doi.org/10.48550/arXiv.2005.02776,CodaQback: A simplified Python Code facilitating auto-windowing for estimating Seismic Coda attenuation parameter
oai:arXiv.org:2005.02786,2020-05-07,physics:physics:geo-ph,https://arxiv.org/pdf/2005.02786,https://doi.org/10.48550/arXiv.2005.02786,Simulation of water flow and solute transport as affected by a soil layer interface and a subsurface drainage system using a numerical model
oai:arXiv.org:2005.02787,2020-05-07,physics:physics:geo-ph,https://arxiv.org/pdf/2005.02787,https://doi.org/10.48550/arXiv.2005.02787,Main Controls on the Stable Carbon Isotope Composition of Speleothems
oai:arXiv.org:2005.02815,2020-05-07,physics:physics:geo-ph,https://arxiv.org/pdf/2005.02815,https://doi.org/10.48550/arXiv.2005.02815,Industrial applications of digital rock technology
oai:arXiv.org:1908.07825,2020-05-11,physics:physics:geo-ph,https://arxiv.org/pdf/1908.07825,https://doi.org/10.48550/arXiv.1908.07825,On the thermodynamics-based equilibrium beach profile derived by Jenkins and Inman
oai:arXiv.org:2005.03910,2020-05-11,physics:physics:geo-ph,https://arxiv.org/pdf/2005.03910,https://doi.org/10.48550/arXiv.2005.03910,Analytical expressions of variable specific yield for layered soils in shallow water table environments
oai:arXiv.org:2005.05219,2020-05-12,physics:physics:geo-ph,https://arxiv.org/pdf/2005.05219,https://doi.org/10.48550/arXiv.2005.05219,Simulating the transport of dissolved ammonium-nitrogen and phosphate-phosphorous to streams using artificial neural network (ANN)
oai:arXiv.org:2005.05622,2020-05-13,physics:physics:geo-ph,https://arxiv.org/pdf/2005.05622,https://doi.org/10.48550/arXiv.2005.05622,Non-equilibrium transport of inhomogeneous shale gas under ultra-tight confinement
oai:arXiv.org:2005.08127,2020-05-19,physics:physics:geo-ph,https://arxiv.org/pdf/2005.08127,https://doi.org/10.48550/arXiv.2005.08127,Bati Karadeniz Havzasinin Guney Bolumunde Akcakoca-Cide Aciklarinda Sikismali Tektonik Rejime Ait Yeni Bulgular
oai:arXiv.org:1908.08356,2020-05-20,physics:physics:geo-ph,https://arxiv.org/pdf/1908.08356,https://doi.org/10.48550/arXiv.1908.08356,Seismic tomography using variational inference methods
oai:arXiv.org:1910.03351,2020-05-20,physics:physics:geo-ph,https://arxiv.org/pdf/1910.03351,https://doi.org/10.48550/arXiv.1910.03351,A Tracer-Based Algorithm for Automatic Generation of Seafloor Age Grids from Plate Tectonic Reconstructions
oai:arXiv.org:1910.08318,2020-05-20,physics:physics:geo-ph,https://arxiv.org/pdf/1910.08318,https://doi.org/10.48550/arXiv.1910.08318,"Fast magma ascent, revised estimates from the deglaciation of Iceland"
oai:arXiv.org:2005.03960,2020-05-21,physics:physics:geo-ph,https://arxiv.org/pdf/2005.03960,https://doi.org/10.48550/arXiv.2005.03960,Utilizing pre-polarization to enhance SNMR signals -- effect of imperfect switch-off
oai:arXiv.org:2005.10160,2020-05-21,physics:physics:geo-ph,https://arxiv.org/pdf/2005.10160,https://doi.org/10.48550/arXiv.2005.10160,Rapid forward of gravity and tensor gravity data
oai:arXiv.org:2005.10395,2020-05-22,physics:physics:geo-ph,https://arxiv.org/pdf/2005.10395,https://doi.org/10.48550/arXiv.2005.10395,Comparing Strategies for Local FWI: FD Injection and Immersive Boundary Conditions
oai:arXiv.org:2005.09899,2020-05-25,physics:physics:geo-ph,https://arxiv.org/pdf/2005.09899,https://doi.org/10.48550/arXiv.2005.09899,Full waveform inversion with random shot selection using adaptive gradient descent
oai:arXiv.org:1904.09321,2020-05-26,physics:physics:geo-ph,https://arxiv.org/pdf/1904.09321,https://doi.org/10.48550/arXiv.1904.09321,Deep Convolutional Neural Network and Sparse Least Squares Migration
oai:arXiv.org:2005.02779,2020-05-27,physics:physics:geo-ph,https://arxiv.org/pdf/2005.02779,https://doi.org/10.48550/arXiv.2005.02779,Forecasting strong aftershocks in earthquake clusters from northeastern Italy and western Slovenia
oai:arXiv.org:2005.12465,2020-05-27,physics:physics:geo-ph,https://arxiv.org/pdf/2005.12465,https://doi.org/10.48550/arXiv.2005.12465,"A Numerical Study on the Effects of Heterogeneity, Anisotropy, and Station Coverage on the Compensated Linear Vector Dipole Component of Deep Earthquake Moment Tensors"
oai:arXiv.org:2005.08868,2020-05-29,physics:physics:geo-ph,https://arxiv.org/pdf/2005.08868,https://doi.org/10.48550/arXiv.2005.08868,Error Control and Loss Functions for the Deep Learning Inversion of Borehole Resistivity Measurements
oai:arXiv.org:2005.13688,2020-05-29,physics:physics:geo-ph,https://arxiv.org/pdf/2005.13688,https://doi.org/10.48550/arXiv.2005.13688,"Great SCO2T! Rapid tool for carbon sequestration science, engineering, and economics"
oai:arXiv.org:1904.02487,2020-06-03,physics:physics:geo-ph,https://arxiv.org/pdf/1904.02487,https://doi.org/10.48550/arXiv.1904.02487,Internal energy dissipation in Enceladus's ocean from tides and libration and the role of inertial waves
oai:arXiv.org:2006.01360,2020-06-03,physics:physics:geo-ph,https://arxiv.org/pdf/2006.01360,https://doi.org/10.48550/arXiv.2006.01360,Near-surface Characterization Using a Roadside Distributed Acoustic Sensing Array
oai:arXiv.org:2006.02125,2020-06-04,physics:physics:geo-ph,https://arxiv.org/pdf/2006.02125,https://doi.org/10.48550/arXiv.2006.02125,Blasting Operations Using Different Initiation Methods in Deep Underground Mines
oai:arXiv.org:2006.02160,2020-06-04,physics:physics:geo-ph,https://arxiv.org/pdf/2006.02160,https://doi.org/10.48550/arXiv.2006.02160,Numerical Simulations of Geomechanical State of Rock Mass Prior to Seismic Events Occurrence: Case Study From a Polish Copper Mine Aided by FEM 3D Approach
oai:arXiv.org:2006.02917,2020-06-05,physics:physics:geo-ph,https://arxiv.org/pdf/2006.02917,https://doi.org/10.48550/arXiv.2006.02917,The effective mitigation of greenhouse gas emissions from rice paddies without compromising yield by early-season drainage
oai:arXiv.org:2003.01578,2020-06-08,physics:physics:geo-ph,https://arxiv.org/pdf/2003.01578,https://doi.org/10.48550/arXiv.2003.01578,Altitude effects of localized source currents on magnetotelluric responses
oai:arXiv.org:1707.06580,2020-06-09,physics:physics:geo-ph,https://arxiv.org/pdf/1707.06580,https://doi.org/10.48550/arXiv.1707.06580,"Marchenko-based target replacement, accounting for all orders of multiple reflections"
oai:arXiv.org:1905.01737,2020-06-09,physics:physics:geo-ph,https://arxiv.org/pdf/1905.01737,https://doi.org/10.48550/arXiv.1905.01737,Estimating the duration effects in structural responses by a new energy-cycle based parameter
oai:arXiv.org:1905.02369,2020-06-09,physics:physics:geo-ph,https://arxiv.org/pdf/1905.02369,https://doi.org/10.48550/arXiv.1905.02369,Correlation of ground motion duration with its intensity metrics: A simulation based approach
oai:arXiv.org:1906.10103,2020-06-09,physics:physics:geo-ph,https://arxiv.org/pdf/1906.10103,https://doi.org/10.48550/arXiv.1906.10103,Reciprocity and representation theorems for flux- and field-normalised decomposed wave fields
