identifier,date,set,download,doi,title
oai:arXiv.org:1305.0060,2015-06-15,physics:physics:geo-ph,https://arxiv.org/pdf/1305.0060,https://doi.org/10.48550/arXiv.1305.0060,Complexity penalized hydraulic fracture localization and moment tensor estimation under limited model information
oai:arXiv.org:1305.1179,2015-06-15,physics:physics:geo-ph,https://arxiv.org/pdf/1305.1179,https://doi.org/10.48550/arXiv.1305.1179,Spatial heterogeneity in earthquake fault-like systems
oai:arXiv.org:1306.2482,2015-06-16,physics:physics:geo-ph,https://arxiv.org/pdf/1306.2482,https://doi.org/10.48550/arXiv.1306.2482,Thermal convection in Earth's inner core with phase change at its boundary
oai:arXiv.org:1307.3464,2015-06-16,physics:physics:geo-ph,https://arxiv.org/pdf/1307.3464,https://doi.org/10.48550/arXiv.1307.3464,Forecasting ability of a multi-renewal seismicity model for Italy
oai:arXiv.org:1408.4976,2015-06-16,physics:physics:geo-ph,https://arxiv.org/pdf/1408.4976,https://doi.org/10.48550/arXiv.1408.4976,Glacial cycles drive variations in the production of oceanic crust
oai:arXiv.org:1309.4583,2015-06-17,physics:physics:geo-ph,https://arxiv.org/pdf/1309.4583,https://doi.org/10.48550/arXiv.1309.4583,Intermittency and Slip-Size Distribution in the Block-Spring Model of Earthquakes
oai:arXiv.org:1310.2977,2015-06-17,physics:physics:geo-ph,https://arxiv.org/pdf/1310.2977,https://doi.org/10.48550/arXiv.1310.2977,Statistical earthquake focal mechanism forecasts
oai:arXiv.org:1310.3732,2015-06-17,physics:physics:geo-ph,https://arxiv.org/pdf/1310.3732,https://doi.org/10.48550/arXiv.1310.3732,Geo-neutrinos
oai:arXiv.org:1310.6848,2015-06-17,physics:physics:geo-ph,https://arxiv.org/pdf/1310.6848,https://doi.org/10.48550/arXiv.1310.6848,Bayesian inversion for the filtered flow at the Earth's Core Mantle Boundary
oai:arXiv.org:1503.05111,2015-06-17,physics:physics:geo-ph,https://arxiv.org/pdf/1503.05111,https://doi.org/10.48550/arXiv.1503.05111,Anomalous diffusion of volcanic earthquakes
oai:arXiv.org:1311.6502,2015-06-18,physics:physics:geo-ph,https://arxiv.org/pdf/1311.6502,https://doi.org/10.48550/arXiv.1311.6502,A simplified model of collision-driven dynamo action in small bodies
oai:arXiv.org:1311.7395,2015-06-18,physics:physics:geo-ph,https://arxiv.org/pdf/1311.7395,https://doi.org/10.48550/arXiv.1311.7395,Predictive Scaling Laws for Spherical Rotating Dynamos
oai:arXiv.org:1312.0595,2015-06-18,physics:physics:geo-ph,https://arxiv.org/pdf/1312.0595,https://doi.org/10.48550/arXiv.1312.0595,Three-dimensional phase-field study of crack-seal microstructures - Insights from innovative post-processing techniques
oai:arXiv.org:1401.3247,2015-06-18,physics:physics:geo-ph,https://arxiv.org/pdf/1401.3247,https://doi.org/10.48550/arXiv.1401.3247,Nucleation process in the Burridge-Knopoff model of earthquakes
oai:arXiv.org:1404.0136,2015-06-19,physics:physics:geo-ph,https://arxiv.org/pdf/1404.0136,https://doi.org/10.48550/arXiv.1404.0136,Scaling of convective velocity in a vertically vibrated granular bed
oai:arXiv.org:1404.6366,2015-06-19,physics:physics:geo-ph,https://arxiv.org/pdf/1404.6366,https://doi.org/10.48550/arXiv.1404.6366,"Pipe Poiseuille flow of viscously anisotropic, partially molten rock"
oai:arXiv.org:1404.6692,2015-06-19,physics:physics:geo-ph,https://arxiv.org/pdf/1404.6692,https://doi.org/10.48550/arXiv.1404.6692,"Regional study of the Archean to Proterozoic crust at the Sudbury Neutrino Observatory (SNO+), Ontario: Predicting the geoneutrino flux"
oai:arXiv.org:1405.3639,2015-06-19,physics:physics:geo-ph,https://arxiv.org/pdf/1405.3639,https://doi.org/10.48550/arXiv.1405.3639,Foreshocks and b-value: bridging macroscopic observations to source mechanical considerations
oai:arXiv.org:1405.4091,2015-06-19,physics:physics:geo-ph,https://arxiv.org/pdf/1405.4091,https://doi.org/10.48550/arXiv.1405.4091,Weak turbulence theory for rotating magnetohydrodynamics and planetary dynamos
oai:arXiv.org:1405.4622,2015-06-19,physics:physics:geo-ph,https://arxiv.org/pdf/1405.4622,https://doi.org/10.48550/arXiv.1405.4622,Local changes in the total electron content immediately before the 2009 Abruzzo earthquake
oai:arXiv.org:1405.5615,2015-06-19,physics:physics:geo-ph,https://arxiv.org/pdf/1405.5615,https://doi.org/10.48550/arXiv.1405.5615,Study of typical space wave-particle coupling events possibly related with seismic activity
oai:arXiv.org:1405.5791,2015-06-19,physics:physics:geo-ph,https://arxiv.org/pdf/1405.5791,https://doi.org/10.48550/arXiv.1405.5791,Modeling of magnitude distributions by the generalized truncated exponential distribution
oai:arXiv.org:1405.5934,2015-06-19,physics:physics:geo-ph,https://arxiv.org/pdf/1405.5934,https://doi.org/10.48550/arXiv.1405.5934,Likelihood analysis of earthquake focal mechanism distributions
oai:arXiv.org:1406.6581,2015-06-22,physics:physics:geo-ph,https://arxiv.org/pdf/1406.6581,https://doi.org/10.48550/arXiv.1406.6581,Transition between viscous dipolar and inertial multipolar dynamos
oai:arXiv.org:1408.0749,2015-06-22,physics:physics:geo-ph,https://arxiv.org/pdf/1408.0749,https://doi.org/10.48550/arXiv.1408.0749,Long-period surface motion of the multi-patch Mw9.0 Tohoku-Oki earthquake
oai:arXiv.org:1506.05970,2015-06-22,physics:physics:geo-ph,https://arxiv.org/pdf/1506.05970,https://doi.org/10.48550/arXiv.1506.05970,Stochastic modelling of regional archaeomagnetic series
oai:arXiv.org:1506.06059,2015-06-22,physics:physics:geo-ph,https://arxiv.org/pdf/1506.06059,https://doi.org/10.48550/arXiv.1506.06059,Atmospheric radiative transfer parametrization for solar energy yield calculations on buildings
oai:arXiv.org:1410.2884,2015-06-23,physics:physics:geo-ph,https://arxiv.org/pdf/1410.2884,https://doi.org/10.48550/arXiv.1410.2884,Validating Velocities in the GeoClaw Tsunami Model using Observations Near Hawaii from the 2011 Tohoku Tsunami
oai:arXiv.org:1411.1020,2015-06-23,physics:physics:geo-ph,https://arxiv.org/pdf/1411.1020,https://doi.org/10.48550/arXiv.1411.1020,Model of deep non-volcanic tremor part II: episodic tremor and slip
oai:arXiv.org:1411.6585,2015-06-23,physics:physics:geo-ph,https://arxiv.org/pdf/1411.6585,https://doi.org/10.48550/arXiv.1411.6585,Characterizing the nonlinear interaction of S- and P-waves in a rock sample
oai:arXiv.org:1412.4231,2015-06-23,physics:physics:geo-ph,https://arxiv.org/pdf/1412.4231,https://doi.org/10.48550/arXiv.1412.4231,Grain-size dynamics beneath mid-ocean ridges: Implications for permeability and melt extraction
oai:arXiv.org:1501.00937,2015-06-23,physics:physics:geo-ph,https://arxiv.org/pdf/1501.00937,https://doi.org/10.48550/arXiv.1501.00937,"Comment on Pisarenko et al. ""Characterization of the Tail of the Distribution of Earthquake Magnitudes by Combining the GEV and GPD Descriptions of Extreme Value Theory"""
oai:arXiv.org:1502.01270,2015-06-23,physics:physics:geo-ph,https://arxiv.org/pdf/1502.01270,https://doi.org/10.48550/arXiv.1502.01270,Is inner core seismic anisotropy a marker of plastic flow of cubic iron?
oai:arXiv.org:1503.00154,2015-06-24,physics:physics:geo-ph,https://arxiv.org/pdf/1503.00154,https://doi.org/10.48550/arXiv.1503.00154,Estimation of Apollo lunar dust transport using optical extinction measurements
oai:arXiv.org:physics/0007026,2015-06-26,physics:physics:geo-ph,https://arxiv.org/pdf/physics/0007026,https://doi.org/10.48550/arXiv.physics/0007026,The GPS global detection of the ionospheric response to solar flares
oai:arXiv.org:physics/0007041,2015-06-26,physics:physics:geo-ph,https://arxiv.org/pdf/physics/0007041,https://doi.org/10.48550/arXiv.physics/0007041,The shock-acoustic waves generated by earthquakes
oai:arXiv.org:physics/0007095,2015-06-26,physics:physics:geo-ph,https://arxiv.org/pdf/physics/0007095,https://doi.org/10.48550/arXiv.physics/0007095,Re-examination of log-periodicity observed in the seismic precursors of the 1989 Loma Prieta earthquake
oai:arXiv.org:physics/0012006,2015-06-26,physics:physics:geo-ph,https://arxiv.org/pdf/physics/0012006,https://doi.org/10.48550/arXiv.physics/0012006,Geomagnetic control of the spectrum of traveling ionospheric disturbances based on data from a global GPS network
oai:arXiv.org:physics/0107030,2015-06-26,physics:physics:geo-ph,https://arxiv.org/pdf/physics/0107030,https://doi.org/10.48550/arXiv.physics/0107030,Ionospheric manifestations of geomagnetic pulsations at high latitudes
oai:arXiv.org:physics/0107031,2015-06-26,physics:physics:geo-ph,https://arxiv.org/pdf/physics/0107031,https://doi.org/10.48550/arXiv.physics/0107031,Inhomogeneous structure of the high-latitude ionosphere as observed at Norilsk
oai:arXiv.org:physics/0202072,2015-06-26,physics:physics:geo-ph,https://arxiv.org/pdf/physics/0202072,https://doi.org/10.48550/arXiv.physics/0202072,Estimating the contribution from different ionospheric regions to the TEC response to the solar flares using data from the international GPS network
oai:arXiv.org:physics/0210130,2015-06-26,physics:physics:geo-ph,https://arxiv.org/pdf/physics/0210130,https://doi.org/10.48550/arXiv.physics/0210130,Foreshocks Explained by Cascades of Triggered Seismicity
oai:arXiv.org:physics/0211046,2015-06-26,physics:physics:geo-ph,https://arxiv.org/pdf/physics/0211046,https://doi.org/10.48550/arXiv.physics/0211046,Traveling wave packets of total electron content disturbances as deduced from global GPS network data
oai:arXiv.org:physics/0303070,2015-06-26,physics:physics:geo-ph,https://arxiv.org/pdf/physics/0303070,https://doi.org/10.48550/arXiv.physics/0303070,Importance of direct and indirect triggered seismicity
oai:arXiv.org:physics/0303075,2015-06-26,physics:physics:geo-ph,https://arxiv.org/pdf/physics/0303075,https://doi.org/10.48550/arXiv.physics/0303075,Are Aftershocks of Large Californian Earthquakes Diffusing?
oai:arXiv.org:physics/0305033,2015-06-26,physics:physics:geo-ph,https://arxiv.org/pdf/physics/0305033,https://doi.org/10.48550/arXiv.physics/0305033,The particle-in-cell model for ab initio thermodynamics: implications for the elastic anisotropy of the Earth's inner core
oai:arXiv.org:physics/0305079,2015-06-26,physics:physics:geo-ph,https://arxiv.org/pdf/physics/0305079,https://doi.org/10.48550/arXiv.physics/0305079,Multifractality of river runoff and precipitation: Comparison of fluctuation analysis and wavelet methods
oai:arXiv.org:physics/0310087,2015-06-26,physics:physics:geo-ph,https://arxiv.org/pdf/physics/0310087,https://doi.org/10.48550/arXiv.physics/0310087,Dynamics of Crystal Formation in the Greenland NorthGRIP Ice Core
oai:arXiv.org:physics/0402092,2015-06-26,physics:physics:geo-ph,https://arxiv.org/pdf/physics/0402092,https://doi.org/10.48550/arXiv.physics/0402092,One million year old groundwater in the Sahara revealed by krypton-81 and chlorine-36
oai:arXiv.org:physics/0405115,2015-06-26,physics:physics:geo-ph,https://arxiv.org/pdf/physics/0405115,https://doi.org/10.48550/arXiv.physics/0405115,Application of the Yin-Yang grid to a thermal convection of a Boussinesq fluid with infinite Prandtl number in a three-dimensional spherical shell
oai:arXiv.org:physics/0407074,2015-06-26,physics:physics:geo-ph,https://arxiv.org/pdf/physics/0407074,https://doi.org/10.48550/arXiv.physics/0407074,Altitude dependence of atmospheric temperature trends: Climate models versus observation
oai:arXiv.org:physics/0407075,2015-06-26,physics:physics:geo-ph,https://arxiv.org/pdf/physics/0407075,https://doi.org/10.48550/arXiv.physics/0407075,Disparity of tropospheric and surface temperature trends: New evidence
oai:arXiv.org:physics/0409032,2015-06-26,physics:physics:geo-ph,https://arxiv.org/pdf/physics/0409032,https://doi.org/10.48550/arXiv.physics/0409032,GPS radio occultation with GRACE: Atmospheric profiling utilizing the zero difference technique
oai:arXiv.org:physics/0504218,2015-06-26,physics:physics:geo-ph,https://arxiv.org/pdf/physics/0504218,https://doi.org/10.48550/arXiv.physics/0504218,Simulation Study of the One-Dimensional Burridge-Knopoff Model of Earthquakes
oai:arXiv.org:physics/0507082,2015-06-26,physics:physics:geo-ph,https://arxiv.org/pdf/physics/0507082,https://doi.org/10.48550/arXiv.physics/0507082,Earthquake recurrence as a record breaking process
oai:arXiv.org:physics/0509166,2015-06-26,physics:physics:geo-ph,https://arxiv.org/pdf/physics/0509166,https://doi.org/10.48550/arXiv.physics/0509166,Climate Forcing by the Volcanic Eruption of Mount Pinatubo. Revised edition
oai:arXiv.org:physics/0509258,2015-06-26,physics:physics:geo-ph,https://arxiv.org/pdf/physics/0509258,https://doi.org/10.48550/arXiv.physics/0509258,Impact of global seismicity on sea level change assessment
oai:arXiv.org:physics/0510027,2015-06-26,physics:physics:geo-ph,https://arxiv.org/pdf/physics/0510027,https://doi.org/10.48550/arXiv.physics/0510027,Celebrating the Physics in Geophysics
oai:arXiv.org:physics/0510191,2015-06-26,physics:physics:geo-ph,https://arxiv.org/pdf/physics/0510191,https://doi.org/10.48550/arXiv.physics/0510191,Viscosity of high crystal content melts: dependence on solid fraction
oai:arXiv.org:physics/0512180,2015-06-26,physics:physics:geo-ph,https://arxiv.org/pdf/physics/0512180,https://doi.org/10.48550/arXiv.physics/0512180,Low-degree mantle convection with strongly temperature- and depth-dependent viscosity in a three-dimensional spherical shell
oai:arXiv.org:physics/0606074,2015-06-26,physics:physics:geo-ph,https://arxiv.org/pdf/physics/0606074,https://doi.org/10.48550/arXiv.physics/0606074,Computation of a combined spherical-elastic and viscous-half-space earth model for ice sheet simulation
oai:arXiv.org:physics/0703084,2015-06-26,physics:physics:geo-ph,https://arxiv.org/pdf/physics/0703084,https://doi.org/10.48550/arXiv.physics/0703084,Automatic Reconstruction of Fault Networks from Seismicity Catalogs: 3D Optimal Anisotropic Dynamic Clustering
oai:arXiv.org:physics/9901004,2015-06-26,physics:physics:geo-ph,https://arxiv.org/pdf/physics/9901004,https://doi.org/10.48550/arXiv.physics/9901004,4D Tropospheric Tomography using GPS Estimated Slant Delays
oai:arXiv.org:1501.07006,2015-06-29,physics:physics:geo-ph,https://arxiv.org/pdf/1501.07006,https://doi.org/10.48550/arXiv.1501.07006,Quasi-geostrophic modes in the Earth's fluid core with an outer stably stratified layer
oai:arXiv.org:1505.07028,2015-06-29,physics:physics:geo-ph,https://arxiv.org/pdf/1505.07028,https://doi.org/10.48550/arXiv.1505.07028,A Carrington-like geomagnetic storm observed in the 21st century
oai:arXiv.org:1506.09216,2015-07-01,physics:physics:geo-ph,https://arxiv.org/pdf/1506.09216,https://doi.org/10.48550/arXiv.1506.09216,National Report for the International Association of Geodesy of the International Union of Geodesy and Geophysics 2011-2014
oai:arXiv.org:1407.1488,2015-07-15,physics:physics:geo-ph,https://arxiv.org/pdf/1407.1488,https://doi.org/10.48550/arXiv.1407.1488,Dynamics of vertical ionospheric inhomogeneities over Irkutsk during 06:00-06:20UT 11/03/2011 caused by the Tohoku earthquake
oai:arXiv.org:1409.6053,2015-07-15,physics:physics:geo-ph,https://arxiv.org/pdf/1409.6053,https://doi.org/10.48550/arXiv.1409.6053,Optimal signals for spectral measurements at EKB SuperDARN radar: Theory and Experiment
oai:arXiv.org:1507.04539,2015-07-17,physics:physics:geo-ph,https://arxiv.org/pdf/1507.04539,https://doi.org/10.48550/arXiv.1507.04539,On comparison of simulated and observed seismicity
oai:arXiv.org:1506.04981,2015-07-21,physics:physics:geo-ph,https://arxiv.org/pdf/1506.04981,https://doi.org/10.48550/arXiv.1506.04981,Analogies between the cracking noise of ethanol-dampened charcoal and earthquakes
oai:arXiv.org:1507.07220,2015-07-28,physics:physics:geo-ph,https://arxiv.org/pdf/1507.07220,https://doi.org/10.48550/arXiv.1507.07220,A century of oil and gas exploration in Albania: assessment of Naturally Occurring Radioactive Materials (NORMs)
oai:arXiv.org:1507.08160,2015-08-04,physics:physics:geo-ph,https://arxiv.org/pdf/1507.08160,https://doi.org/10.48550/arXiv.1507.08160,A Model for TSUnami FLow INversion from Deposits (TSUFLIND)
oai:arXiv.org:1310.0915,2015-08-05,physics:physics:geo-ph,https://arxiv.org/pdf/1310.0915,https://doi.org/10.48550/arXiv.1310.0915,Inverse of magnetic dipole field using a reversible jump Markov chain Monte Carlo
oai:arXiv.org:1508.01164,2015-08-06,physics:physics:geo-ph,https://arxiv.org/pdf/1508.01164,https://doi.org/10.48550/arXiv.1508.01164,Novel Concept of the Magmatic Heat Extraction
oai:arXiv.org:1410.0753,2015-08-07,physics:physics:geo-ph,https://arxiv.org/pdf/1410.0753,https://doi.org/10.48550/arXiv.1410.0753,Cliffs User Manual
oai:arXiv.org:1508.02261,2015-08-11,physics:physics:geo-ph,https://arxiv.org/pdf/1508.02261,https://doi.org/10.48550/arXiv.1508.02261,Feature-preserving interpolation and filtering of environmental time series
oai:arXiv.org:1505.07066,2015-08-19,physics:physics:geo-ph,https://arxiv.org/pdf/1505.07066,https://doi.org/10.48550/arXiv.1505.07066,Is it appropriate to model turbidity currents with the three-equation model?
oai:arXiv.org:1508.01805,2015-08-19,physics:physics:geo-ph,https://arxiv.org/pdf/1508.01805,https://doi.org/10.48550/arXiv.1508.01805,Revealing pre-earthquake signatures in atmosphere and ionosphere associated with 2015 M7.8 and M7.3 events in Nepal. Preliminary results
oai:arXiv.org:1508.04866,2015-08-21,physics:physics:geo-ph,https://arxiv.org/pdf/1508.04866,https://doi.org/10.48550/arXiv.1508.04866,Friction laws from dimensional-analysis point of view
oai:arXiv.org:1407.1036,2015-09-02,physics:physics:geo-ph,https://arxiv.org/pdf/1407.1036,https://doi.org/10.48550/arXiv.1407.1036,Condensation of earthquake location distributions: Optimal spatial information encoding and application to multifractal analysis of South Californian seismicity
oai:arXiv.org:1509.00386,2015-09-02,physics:physics:geo-ph,https://arxiv.org/pdf/1509.00386,https://doi.org/10.48550/arXiv.1509.00386,Reconstructing eruptive source parameters from tephra deposit: a numerical approach for medium-sized explosive eruptions
oai:arXiv.org:1507.06861,2015-09-04,physics:physics:geo-ph,https://arxiv.org/pdf/1507.06861,https://doi.org/10.48550/arXiv.1507.06861,Methane storage in nanoporous media as observed via high field NMR relaxometry
oai:arXiv.org:1503.02308,2015-09-08,physics:physics:geo-ph,https://arxiv.org/pdf/1503.02308,https://doi.org/10.48550/arXiv.1503.02308,Variations in mid-ocean ridge CO2 emissions driven by glacial cycles
oai:arXiv.org:1507.03960,2015-09-08,physics:physics:geo-ph,https://arxiv.org/pdf/1507.03960,https://doi.org/10.48550/arXiv.1507.03960,Digital terrain modeling with the Chebyshev polynomials
oai:arXiv.org:1506.01638,2015-09-15,physics:physics:geo-ph,https://arxiv.org/pdf/1506.01638,https://doi.org/10.48550/arXiv.1506.01638,The Multiphase Buoyant Plume Solution of the Dusty Gas Model
oai:arXiv.org:1509.04234,2015-09-15,physics:physics:geo-ph,https://arxiv.org/pdf/1509.04234,https://doi.org/10.48550/arXiv.1509.04234,The Geobiology of Weathering: a 13th Hypothesis
oai:arXiv.org:1211.6762,2015-09-25,physics:physics:geo-ph,https://arxiv.org/pdf/1211.6762,https://doi.org/10.48550/arXiv.1211.6762,"Evolving fracture patterns: columnar joints, mud cracks, and polygonal terrain"
oai:arXiv.org:1412.5611,2015-09-30,physics:physics:geo-ph,https://arxiv.org/pdf/1412.5611,https://doi.org/10.48550/arXiv.1412.5611,Analytical Parameterization of Self-Consistent Polycrystal Mechanics: Fast Calculation of Upper Mantle Anisotropy
oai:arXiv.org:1509.09119,2015-10-01,physics:physics:geo-ph,https://arxiv.org/pdf/1509.09119,https://doi.org/10.48550/arXiv.1509.09119,A new design strategy based on a deterministic definition of the seismic input to overcome the limits of design procedures based on probabilistic approaches
oai:arXiv.org:1510.00528,2015-10-05,physics:physics:geo-ph,https://arxiv.org/pdf/1510.00528,https://doi.org/10.48550/arXiv.1510.00528,Long term continuous radon monitoring in a seismically active area
oai:arXiv.org:1502.05485,2015-10-13,physics:physics:geo-ph,https://arxiv.org/pdf/1502.05485,https://doi.org/10.48550/arXiv.1502.05485,A possible resonance mechanism of earthquakes
oai:arXiv.org:1510.03061,2015-10-13,physics:physics:geo-ph,https://arxiv.org/pdf/1510.03061,https://doi.org/10.48550/arXiv.1510.03061,Prediction of novel stable compounds in the Mg-Si-O system under exoplanet pressures
oai:arXiv.org:1509.01701,2015-10-21,physics:physics:geo-ph,https://arxiv.org/pdf/1509.01701,https://doi.org/10.48550/arXiv.1509.01701,Melt transport rates in heterogeneous mantle beneath mid-ocean ridges
oai:arXiv.org:1510.06372,2015-10-22,physics:physics:geo-ph,https://arxiv.org/pdf/1510.06372,https://doi.org/10.48550/arXiv.1510.06372,Simulation of muon radiography for monitoring CO$_2$ stored in a geological reservoir
oai:arXiv.org:1502.04930,2015-10-23,physics:physics:geo-ph,https://arxiv.org/pdf/1502.04930,https://doi.org/10.48550/arXiv.1502.04930,Spectrometry of the Earth using Neutrino Oscillations
oai:arXiv.org:1504.04574,2015-10-26,physics:physics:geo-ph,https://arxiv.org/pdf/1504.04574,https://doi.org/10.48550/arXiv.1504.04574,"Tidal Love numbers of membrane worlds: Europa, Titan, and Co"
oai:arXiv.org:1010.2281,2015-10-27,physics:physics:geo-ph,https://arxiv.org/pdf/1010.2281,https://doi.org/10.48550/arXiv.1010.2281,GNSS Reflectometry and Remote Sensing: New Objectives and Results
oai:arXiv.org:1212.1843,2015-10-27,physics:physics:geo-ph,https://arxiv.org/pdf/1212.1843,https://doi.org/10.48550/arXiv.1212.1843,Analytical estimation of the Earth's magnetic field scale
oai:arXiv.org:0705.1777,2015-10-28,physics:physics:geo-ph,https://arxiv.org/pdf/0705.1777,https://doi.org/10.48550/arXiv.0705.1777,"A case for variational geomagnetic data assimilation: insights from a one-dimensional, nonlinear, and sparsely observed MHD system"
oai:arXiv.org:1404.0405,2015-10-28,physics:physics:geo-ph,https://arxiv.org/pdf/1404.0405,https://doi.org/10.48550/arXiv.1404.0405,A conservative adaptive wavelet method for the shallow water equations on the sphere
oai:arXiv.org:1407.2693,2015-10-28,physics:physics:geo-ph,https://arxiv.org/pdf/1407.2693,https://doi.org/10.48550/arXiv.1407.2693,Dynamics of earthquake nucleation process represented by the Burridge-Knopoff model
oai:arXiv.org:1502.01284,2015-10-28,physics:physics:geo-ph,https://arxiv.org/pdf/1502.01284,https://doi.org/10.48550/arXiv.1502.01284,A porosity-based Biot model for acoustic waves in snow
oai:arXiv.org:1502.03856,2015-10-28,physics:physics:geo-ph,https://arxiv.org/pdf/1502.03856,https://doi.org/10.48550/arXiv.1502.03856,A Multiscale Dynamo Model Driven by Quasi-geostrophic Convection
oai:arXiv.org:1505.00559,2015-10-28,physics:physics:geo-ph,https://arxiv.org/pdf/1505.00559,https://doi.org/10.48550/arXiv.1505.00559,"Melt-preferred orientation, anisotropic permeability, and melt-band formation in a deforming, partially molten aggregate"
oai:arXiv.org:1506.05938,2015-10-28,physics:physics:geo-ph,https://arxiv.org/pdf/1506.05938,https://doi.org/10.48550/arXiv.1506.05938,Experimental evidence of electrification processes at the 2009 LAquila earthquake mainshock
oai:arXiv.org:1511.01389,2015-11-05,physics:physics:geo-ph,https://arxiv.org/pdf/1511.01389,https://doi.org/10.48550/arXiv.1511.01389,"Effect of width, amplitude, and position of a core mantle boundary hot spot on core convection and dynamo action"
oai:arXiv.org:1511.02602,2015-11-10,physics:physics:geo-ph,https://arxiv.org/pdf/1511.02602,https://doi.org/10.48550/arXiv.1511.02602,Earthquake scenarios and seismic input for cultural heritage: applications to the cities of Rome and Florence
oai:arXiv.org:1511.02731,2015-11-10,physics:physics:geo-ph,https://arxiv.org/pdf/1511.02731,https://doi.org/10.48550/arXiv.1511.02731,Lithosphere-asthenosphere system in the Mediterranean region in the framework of polarized plate tectonics
oai:arXiv.org:1511.02852,2015-11-11,physics:physics:geo-ph,https://arxiv.org/pdf/1511.02852,https://doi.org/10.48550/arXiv.1511.02852,VS structure of the crust and upper mantle in the Balkan Peninsula region
oai:arXiv.org:1506.05863,2015-11-20,physics:physics:geo-ph,https://arxiv.org/pdf/1506.05863,https://doi.org/10.48550/arXiv.1506.05863,"Towards the azimuthal characteristics of ionospheric and seismic effects of ""Chelyabinsk"" meteorite fall according to the data from coherent radar, GPS and seismic networks"
oai:arXiv.org:1512.02484,2015-12-09,physics:physics:geo-ph,https://arxiv.org/pdf/1512.02484,https://doi.org/10.48550/arXiv.1512.02484,Uranium distribution in the Variscan Basement of Northeastern Sardinia
oai:arXiv.org:1512.05180,2015-12-17,physics:physics:geo-ph,https://arxiv.org/pdf/1512.05180,https://doi.org/10.48550/arXiv.1512.05180,Failure Mechanism of True 2D Granular Flows
oai:arXiv.org:1512.05181,2015-12-17,physics:physics:geo-ph,https://arxiv.org/pdf/1512.05181,https://doi.org/10.48550/arXiv.1512.05181,"Subglacial hydrology as a control on emergence, scale, and spacing of ice streams"
oai:arXiv.org:1512.05184,2015-12-17,physics:physics:geo-ph,https://arxiv.org/pdf/1512.05184,https://doi.org/10.48550/arXiv.1512.05184,Fracturing tests on reservoir rocks: Analysis of AE events and radial strain evolution
oai:arXiv.org:1512.05188,2015-12-17,physics:physics:geo-ph,https://arxiv.org/pdf/1512.05188,https://doi.org/10.48550/arXiv.1512.05188,Seismic quiescence and b-value decrease before large events in forest-fire model
oai:arXiv.org:1512.05189,2015-12-17,physics:physics:geo-ph,https://arxiv.org/pdf/1512.05189,https://doi.org/10.48550/arXiv.1512.05189,A Quantitative Investigation of CO2 Sequestration by Mineral Carbonation
oai:arXiv.org:1507.05025,2015-12-22,physics:physics:geo-ph,https://arxiv.org/pdf/1507.05025,https://doi.org/10.48550/arXiv.1507.05025,"High-pressure, temperature elasticity of Fe- and Al-bearing MgSiO3: implications for the Earth's lower mantle"
